[
  {
    "id": "el-regajo-camping-fishing",
    "title": "El Regajo: палатка, рыбалка и подготовка к ночёвке",
    "summary": "Разобран практический сценарий ночёвки с палаткой и рыбалкой у Embalse del Regajo/Jérica: где оформлять разрешение, как отличать официальную zona de acampada от просто рекреационной зоны, какие разрешения относятся к палатке и рыбалке отдельно, и как искать снаряжение в испанских магазинах. Отдельно сравнили варианты на Эбро и Fuente Muñoz.",
    "category": "Поездки и природа",
    "tags": [
      "camping",
      "fishing",
      "el-regajo",
      "jerica",
      "gva",
      "fuente-munoz",
      "ebro"
    ],
    "favorite": false,
    "decisions": [
      "Для El Regajo палатку нужно ставить только в официальной zona de acampada, а не в любой красивой точке у воды.",
      "Бронирование/оформление делается через официальный портал Generalitat Valenciana: montes-acampadas.gva.es, раздел Zona d’acampada / Buscador.",
      "В материалах по Jérica встречаются участки Embalse del Regajo и названия El Campillo / El Depósito; указатели рекреационной зоны сами по себе не доказывают, что конкретный пятачок разрешён для палатки.",
      "Рыбалка и ночёвка — разные разрешительные вопросы: для рыбалки нужна соответствующая licencia de pesca continental, а палатка оформляется отдельно.",
      "На Эбро нет одного общего аналога портала El Regajo на всю реку: правила и доступные зоны зависят от автономии и конкретного муниципалитета; официальный кемпинг или местная autorizada zona de acampada обычно надёжнее дикого варианта.",
      "Для Fuente Muñoz дата брони сама по себе не подтверждает право ставить палатку в 00:01: явного официального часа въезда в найденных материалах не было, поэтому без отдельного подтверждения безопаснее приезжать в обычное дневное время.",
      "Для поиска туристического снаряжения в Испании полезные термины: esterilla aislante / aislante de espuma для пенки и saco de dormir для спальника.",
      "Персональные данные из водительских документов, которые встречались в исходном чате, в DashGPT Result не публикуются."
    ],
    "next": "Перед следующей поездкой заново проверить актуальную доступность и правила выбранной зоны на официальном портале, затем открыть сохранённую страницу Result как чек-лист по разрешениям и подготовке.",
    "source": {
      "type": "chatgpt-share",
      "url": "https://chatgpt.com/share/6a787ebb-dd38-83eb-940a-bd6c77efad95",
      "title": "Разрешение на ночёвку"
    },
    "publishedAt": "2026-08-09T13:30:00Z",
    "immutable": true,
    "contentVersion": 1,
    "contentHash": "sha256:2ccd5e43f6fe5df6c69f697e9a7310790f2ee4943be54616b2a5c89713fc731b"
  },
  {
    "id": "chicken-kiev-380g-airfryer",
    "title": "Котлета по-киевски: 380 г грудки, сковорода + аэрогриль",
    "summary": "Для классической котлеты по-киевски нужен не фарш, а цельная куриная грудка (pechuga de pollo). Для одной грудки 380 г удобнее сделать две котлеты примерно по 190 г: положить по 30–35 г замороженного масла, сделать двойную панировку, быстро подрумянить на сковороде и затем спокойно довести в аэрогриле.",
    "category": "Еда",
    "tags": [
      "chicken-kiev",
      "pechuga",
      "air-fryer",
      "xiaomi",
      "recipe"
    ],
    "favorite": false,
    "decisions": [
      "Классическая котлета по-киевски делается из цельной куриной грудки, а не из фарша.",
      "380 г грудки лучше разделить на две порции примерно по 190 г, чтобы они готовились равномернее и масло реже вытекало.",
      "На каждую котлету использовать около 30–35 г хорошо замороженного сливочного масла с петрушкой.",
      "Панировка двойная: мука → яйцо → сухари → яйцо → сухари; после панировки котлеты хорошо охладить.",
      "Удобная схема приготовления: обжарить на сковороде примерно по 1–1,5 минуты с каждой стороны до корочки, затем довести в аэрогриле при 170°C примерно 10–13 минут.",
      "Готовность проверять по мясу: около 74°C, термометр вводить сбоку, не прокалывая масляный центр."
    ],
    "next": "Приготовить две котлеты из имеющихся 380 г грудки по схеме сковорода → аэрогриль и по фактической толщине скорректировать время, ориентируясь на 74°C внутри мяса.",
    "source": {
      "type": "chatgpt-share",
      "url": "https://chatgpt.com/share/6a7873ab-2160-83eb-a57a-9fbdc7034314",
      "title": "Котлета по-киевски рецепт"
    },
    "publishedAt": "2026-08-09T12:46:00Z",
    "immutable": true,
    "contentVersion": 1,
    "contentHash": "sha256:18b37a2a8b8005eef7debd0208b5bd6e599aa1443b3560b8a54ab0be27d30b20"
  },
  {
    "id": "dashgpt-first-live-demo",
    "title": "DashGPT — от идеи до первой живой демки",
    "summary": "DashGPT задуман как приватный result-first дашборд: сохранять не сырые чаты, а полезные результаты, решения и переносимый контекст, чтобы продолжать работу в любом AI-агенте. Мы зафиксировали продукт и процесс разработки в GitHub, выбрали OpenSpec для spec-driven workflow, сделали M1 vertical slice и выкатили первую демку через Cloudflare Workers.",
    "category": "DashGPT",
    "tags": [
      "product",
      "m1",
      "cloudflare",
      "context",
      "openspec"
    ],
    "favorite": true,
    "decisions": [
      "Result-first, not chat-first: сырой чат — источник, а не главная сущность.",
      "Контекст принадлежит пользователю и должен переноситься между ChatGPT, Claude, Codex, OpenCode и другими агентами.",
      "Core остаётся local-first и cloud-optional; Cloudflare и GitHub — удобные адаптеры, а не обязательная зависимость.",
      "Разработка spec-driven; durable project state хранится в репозитории, агенты взаимозаменяемы.",
      "Первый M1 доказывает цикл Result → поиск/избранное → детали → Context Pack."
    ],
    "next": "Проверить демку как реальный пользователь, закрыть доступ через Cloudflare Access, затем перейти от browser-only localStorage к общей persistence и импорту настоящих Results из AI-чатов.",
    "publishedAt": "2026-08-09T12:22:15Z",
    "immutable": true,
    "contentVersion": 1,
    "contentHash": "sha256:b32f28233dcc4f57822dd4b99e3ec1135b9fb642893aa1c810451aa41b1a9af8"
  },
  {
    "id": "cold-soups-chogyetang",
    "title": "Холодные супы на бульоне: чогетхан и другие варианты",
    "summary": "Искали холодные супы на курином бульоне по разным кухням: французские, европейские, азиатские и кавказские. Отдельно разобрали корейские нэнмён и чогетхан. Для домашнего варианта особенно подходит чогетхан — холодный куриный суп с лапшой; имеющуюся рисовую лапшу можно использовать как практичную замену традиционной.",
    "category": "Еда",
    "tags": [
      "cold-soup",
      "korean",
      "chogyetang",
      "naengmyeon",
      "rice-noodles"
    ],
    "favorite": false,
    "decisions": [
      "Чогетхан — основной кандидат, когда нужен именно холодный суп на курином бульоне.",
      "Рисовая лапша подходит для домашней версии, даже если это не самый традиционный вариант.",
      "Нэнмён оставить альтернативой, если хочется более яркого корейского холодного супа."
    ],
    "next": "Собрать короткий финальный рецепт чогетхана под конкретный объём бульона и продукты, которые есть дома.",
    "publishedAt": "2026-08-09T12:22:15Z",
    "immutable": true,
    "contentVersion": 1,
    "contentHash": "sha256:5bdc39f8f143243dc9bdc07b60ede00cafb18fbcf94734a0c4dded8e2812efb2"
  }
]
